{
  "schema": "semantic_capture_event_v1",
  "run_id": "run_otel0000000001",
  "record_id": "record_otel000000001",
  "seq": 7,
  "observed_at": "2026-01-01T00:00:06.000Z",
  "monotonic_ns": 7,
  "trace_id": "trace_otel000000001",
  "source": {
    "source_id": "fixture.app/otel-route-fixture",
    "name": "otel-route-fixture",
    "seam": "opentelemetry-additive-processor",
    "identity_domain": "otel",
    "official": false,
    "version": "fixture"
  },
  "native_identity": "span_fixture0000001",
  "event_kind": "log",
  "phase": "event",
  "name": "otel.log_record",
  "native": {
    "severity_text": "INFO",
    "body": "synthetic log",
    "instrumentation_scope": { "name": "fixture.scope", "version": "fixture" },
    "dropped_attributes_count": 0
  },
  "semantic": { "coverage": "unknown" },
  "correlation": { "traceparent": "00-00000000000000000000000000000001-0000000000000001-01" },
  "loss_refs": [],
  "blob_refs": [],
  "provenance": {
    "language": "python",
    "sdk_name": "semantic-layer-capture",
    "sdk_version": "fixture",
    "capture_policy": "rich_local_credential_scrubbed"
  }
}
